{"built_at":"2026-08-27T04:45:51Z","bundle_a_ciphertext_sha256":"b6f5f6deebf7c5784ff403e06915ea54178399737b5a6340cca233f02d07c9e2","bundle_a_state":"protected-local","bundle_b_bytes":116314024,"bundle_b_ciphertext_sha256":"31b77331e8e8d23bb5177d977007632a67d8d8da22832667aeacbf941e28b97e","bundle_b_encryption":"aws:kms","bundle_b_object_key_sha256":"597d15ebe79ac54dbdd3a787867bf44c38379901e3dbd33a6e16d36898307324","bundle_b_publication_evidence_sha256":"12c682ebc225da0e3435b4a1df5f565117930446c309b86867be946fc7dabdcf","bundle_b_state":"published-verified","bundle_b_version_id_sha256":"1745304c103e11d6f405b87bcc3be27ac34e37b96898d5250d1f1c14908c8185","independent_ciphertexts":true,"plaintext_sha256":"5c6a6189d6f8f1caa00196397b5f3bc971cc606667d5760c220bdf6890a2e25d","source_commit":"280f58692b087e5d8f937848beee1c953e4a2859","totp_secret_included":true,"version":1}
